{
  "schema_version": 1,
  "producer_command": "fixture",
  "contract_version": "phase23.8.6f-v1",
  "evaluation_id": "routing-evaluation-4fc1a50977ed191663aaa5376639b48917c553f56e63a33584aac61f3926fb1b",
  "evaluation_host_run_instance_id": "host-instance",
  "source_run_instance_id": "source-instance",
  "source_lifecycle_status": "harvested",
  "source_packet_artifact_id": "review-replay-packet-source",
  "source_approved_attempt_id": "attempt-source",
  "evaluation_mode": "replay",
  "policy_version": "phase23.8.6f-route-v1",
  "binding_version": "phase23.8.6f-codex-v1",
  "candidate_profile_id": "candidate-balanced-medium",
  "created_at": "2026-07-21T00:00:00.000Z",
  "cases": [
    {
      "case_id": "authority-conflict",
      "procedure_id": "implementation-review",
      "pass_kind": "implementation_review",
      "risk_classes": ["authority"],
      "baseline_attempt_id": "baseline-1",
      "candidate_attempt_id": "candidate-1",
      "baseline_observation_record_id": "review-invocation-baseline-1",
      "candidate_observation_record_id": "review-invocation-candidate-1",
      "candidate_output_hash": "sha256:candidate-output",
      "context_core_id": "context-core-source",
      "context_manifest_id": "context-manifest-source",
      "delta_overlay_id": "review-delta-source",
      "expected_critical_findings": ["authority-blocker"],
      "actual_critical_findings": ["authority-blocker"],
      "baseline_verdict": "AMEND_REQUIRED",
      "candidate_verdict": "AMEND_REQUIRED",
      "legal_lifecycle": true,
      "independence_preserved": true,
      "output_valid": true,
      "evidence_valid": true,
      "baseline_fix_passes": 1,
      "candidate_fix_passes": 0,
      "baseline_total_tokens": 5000,
      "candidate_total_tokens": 4000
    }
  ]
}
